time,match_name,home_code,draw_code,away_code
18:30,FC Schalke 04 vs SC Freiburg,3.10,3.50,2.20
20:30,1 FC Cologne vs Bayer Leverkusen,5.20,4.50,1.55
20:30,Bayern Munich vs VfL Wolfsburg,1.33,5.50,8.00
20:30,TSG 1899 Hoffenheim vs RB Leipzig,4.50,4.50,1.62
20:30,Arminia Bielefeld vs FC Augsburg,2.75,3.20,2.60
18:30,Holstein Kiel vs 1. FC Nuremberg,2.20,3.50,3.20
18:30,Fortuna Dusseldorf vs VfL 1899 Osnabrück,2.30,3.20,3.20
18:30,SC Paderborn 07 vs Eintr. Braunschweig,1.55,4.20,5.70
19:00,SV Meppen vs FSV Zwickau,2.40,3.50,2.80
19:00,Bayern M. II vs MSV Duisburg,1.75,4.20,4.00
19:00,FC Ingolstadt vs FC Hansa Rostock,2.45,3.10,3.00
19:00,FC Viktoria Cologne vs KFC Uerdingen 05,2.80,3.30,2.50
18:30,Home Teams Goals vs Away Teams Goals,2.10,8.00,2.00
18:30,Home Teams Goals vs Away Teams Goals,1.50,7.00,3.50
18:00,Großaspach vs FC Homburg,2.90,3.20,2.25
18:00,FSV Mainz 05 II vs TUS Rot-Weiss Koblenz,1.65,3.70,4.30
18:00,Preußen 06 Münster vs Alemannia Aachen,2.25,3.10,3.00
19:00,ROT Weiss Ahlen vs Fortuna Cologne,4.50,3.80,1.60
19:30,Bergisch Gladbach vs Wuppertaler SV,3.20,3.40,2.00
19:30,SV 19 Straelen vs VfB Homberg,2.10,3.40,3.00
19:00,Arsenal FC vs Southampton FC,2.10,3.40,3.40
19:00,Leicester City vs Everton FC,2.10,3.40,3.40
19:00,Leeds United vs Newcastle United,1.70,3.90,4.60
21:00,Liverpool FC vs Tottenham Hotspur,1.85,3.90,3.80
21:00,West Ham United vs Crystal Palace,2.15,3.30,3.40
21:00,Fulham FC vs Brighton & Hove,2.80,3.30,2.50
18:30,Derby County vs Swansea City,3.10,3.00,2.35
20:00,Middlesbrough vs Luton Town,1.80,3.20,4.50
20:45,Blackburn Rovers vs Rotherham United,1.60,3.80,5.20
20:45,Cardiff City vs Birmingham City,1.95,3.00,4.20
21:00,Reading FC vs Norwich City,3.00,3.20,2.30
21:00,Coventry City vs Huddersfield Town,2.25,3.10,3.10
19:00,Home Teams Goals vs Away Teams Goals,1.45,9.50,3.30
21:00,FC Barcelona vs Real Sociedad,1.55,4.50,5.20
18:00,CE L'hospitalet vs UD Almeria,3.20,3.00,2.20
18:00,San Fernando CD vs CD Castellon,2.65,3.00,2.55
18:00,CF Cordoba vs Albacete Balompie,2.35,3.00,2.90
18:00,CD Quintanar D. R. vs Sporting Gijon,8.50,4.40,1.32
19:00,CD Cardassar vs Atletico Madrid,40.00,12.00,12.00
19:00,UE Llagostera vs Espanyol Barcelona,15.00,5.50,1.17
19:00,Terrassa Olímpica vs CF Valencia,17.00,6.20,1.13
19:00,Racing Murcia vs UD Levante,12.00,6.50,1.15
19:00,RS Gimnastica de Torrelavega vs Real Zaragoza,8.50,4.40,1.32
19:00,SD Amorebieta vs UD Logrones,3.20,2.90,2.25
19:00,Las Rozas CF vs CD Mirandes,6.70,4.40,1.37
19:00,CD Atletico Baleares vs Fuenlabrada CF,4.10,3.10,1.85
19:00,Intl. de Madrid Boad. vs CD Linares,2.60,3.00,2.60
19:00,CD Ibiza Islas Pitiusas vs CE Sabadell,5.50,3.50,1.57
19:30,CD Guijuelo vs RCD Mallorca,10.00,4.70,1.27
19:30,Rayo Majadahonda vs Yeclano Deportivo,1.47,4.00,5.70
19:30,Numancia CD vs Lorca Deportiva CF,1.60,3.40,5.20
20:00,Marbella FC vs Club Lleida Esportiu,2.15,3.10,3.20
20:30,CD Calahorra vs CF La Nucia,1.75,3.10,4.70
21:00,SD Leioa vs Villarreal CF,12.00,5.70,1.18
21:00,CD Bunol vs Elche CF,25.00,8.50,1.06
21:00,CD Rincon vs CD Alaves,40.00,12.00,12.00
21:00,CD Marino vs UD Cornella,3.60,3.20,1.95
18:30,Juventus FC vs Atalanta Bergamo,1.82,3.70,4.10
20:45,Genoa FC vs AC Milan,7.00,4.60,1.43
20:45,Inter Milan vs SSC Napoli,2.20,3.40,3.20
20:45,AC Fiorentina vs US Sassuolo,2.45,3.40,2.80
20:45,Hellas Verona vs UC Sampdoria,2.15,3.40,3.30
20:45,Spezia Calcio vs Bologna FC,2.85,3.40,2.40
20:45,Parma Calcio vs Cagliari Calcio,2.30,3.40,3.00
19:00,Dijon FCO vs Lille OSC,7.50,4.40,1.42
19:00,Montpellier HSC vs FC Metz,1.60,3.80,5.70
19:00,Angers SCO vs Racing Strasbourg,2.30,3.40,3.00
19:00,Olympique Nimes vs OGC Nice,4.20,3.80,1.80
19:00,Stade de Reims vs FC Nantes,2.40,3.20,3.00
21:00,Paris St Germain vs FC Lorient,1.13,8.50,17.00
21:00,Olympique Lyon vs Stade Brest 29,1.27,6.00,9.50
21:00,AS Monaco vs RC Lens,1.55,4.30,5.50
21:00,Stade Rennes vs Olympique Marseille,2.35,3.20,3.10
21:00,Bordeaux vs AS Saint Etienne,2.30,3.20,3.20
18:00,LASK Linz vs ASK Elektra,1.01,15.00,40.00
20:30,FC Salzburg vs SK Rapid Vienna,1.25,6.00,8.50
19:00,Fenerbahce vs Karacabey Belediyes,1.05,9.00,25.00
18:45,De Graafschap vs PSV Eindhoven,7.50,5.00,1.30
21:00,Ajax Amsterdam vs FC Utrecht,1.27,5.20,7.50
18:45,Royal Antwerp vs SV Zulte Waregem,1.45,4.70,6.00
21:00,KAA Gent vs Waasland-Beveren,1.42,4.70,6.50
21:00,KV Kortrijk vs Standard Liege,3.10,3.30,2.30
19:45,FC Porto vs FC Pacos Ferreira,1.55,3.90,5.50
22:00,Benfica Lisbon vs Vitoria Guimaraes,1.35,4.70,7.50
21:30,SCU Torreense (F) vs CS Maritimo Madeira (W),2.45,3.50,2.40
18:15,FC Luzern vs FC Zurich,2.15,3.70,3.10
20:30,FC Basel vs BSC Young Boys,4.00,4.00,1.80
20:30,FC St. Gallen vs FC Lugano,2.00,3.60,3.50
18:00,Bayern Munich (W) vs AFC Ajax (W),1.04,10.00,25.00
18:30,LSK Kvinner FK (W) vs WFC Minsk (W),1.32,5.00,7.00
19:00,Fortuna Hjorring (W) vs ZNK Pomurje (W),12.00,40.00,40.00
20:00,Glasgow City LFC (W) vs AC Sparta Prague (W),3.30,3.40,1.95
20:00,Chelsea LFC (W) vs SL Benfica (W),12.00,40.00,40.00
23:15,Defensa y Justicia vs EC Bahia,2.05,3.40,3.30
23:15,Santos Futebol Clube vs Grêmio Foot-Ball Porto Alegrense,3.50,3.10,2.10
18:30,AGF Aarhus vs AC Horsens,1.25,5.20,9.00
20:30,Lech Poznan vs MKS Pogon Szczecin,1.75,3.60,4.20
20:45,Livingston FC vs Ross County FC,1.70,3.50,4.70
21:00,St Mirren FC vs Rangers FC,12.00,5.70,1.20
18:00,Odds BK vs Molde FK,2.60,3.80,2.30
18:30,AEK Athens FC vs Olympiacos FC,3.90,3.20,1.95
22:00,Irapuato vs Cruz Azul Hidalgo,2.20,3.40,2.80
18:00,Zenit St. Petersburg vs FC Spartak Moscow,1.65,3.80,4.50
18:30,FC Voluntari vs Chindia Targoviste,2.65,3.00,2.70
18:15,Slovan Bratislava vs MSK Zilina,1.32,5.00,8.00
18:00,Zalaegerszegi TE vs MTK Budapest,2.10,3.60,2.90
18:00,Budapest Honved FC vs Diosgyori VTK,1.80,3.40,3.90
20:15,Paksi FC vs Ferencvarosi TC,4.40,3.40,1.70
20:15,Budafoki Mte vs Mezokovesd Zsory,2.35,3.20,2.75
20:45,Haverfordwest vs Barry Town United FC,2.80,3.60,2.15
19:00,Hapoel Hadera vs Hapoel Beer Sheva,3.60,3.10,2.00
19:45,Maccabi Tel Aviv vs Maccabi Netanya,1.32,4.40,8.00
18:00,Hapoel Raanana vs Hapoel Iksal FC,1.60,3.60,5.00
20:00,Club Atletico Palmaflor vs The Strongest,5.70,4.40,1.40
20:30,Grêmio Esportivo Brasil vs Botafogo FC,2.35,2.75,3.20
23:15,Associação Chapecoense de Futebol vs Clube Nautico,1.60,3.40,5.50
23:15,Guarani Futebol Clube vs Associação Desportiva Confiança,2.30,2.80,3.20
19:30,Nova Mutum EC MT vs Luverdense Esporte Clube,1.80,3.40,3.80
19:45,Altos PI vs 4 de Julho PI,1.70,3.40,4.40
20:00,River PI vs EC Timon PI,3.70,3.90,1.70
19:00,Nova Iguacu FC vs Sampaio Correa RJ,2.05,3.10,3.30
19:00,EC XV de Novembro vs Marília Atlético Clube,1.80,3.20,4.10
22:00,Deportes Iquique vs Uni. de Concepcion,2.35,3.00,2.90
22:00,Deportes Linares vs Lautaro de Buin,5.30,3.80,1.50
22:00,CD Liberal vs Ilopaneco,1.45,4.00,6.00
22:00,AD Destroyer FC vs Marte Soyapango,1.40,4.50,5.50
22:00,Atl. Ind. Chorrera vs Costa Del Este FC,1.90,3.00,3.90
18:00,Orlando Pirates FC vs Chippa United,1.52,3.60,6.00
18:30,Bloemfontein Celtic vs Baroka FC,2.30,2.80,3.20
18:30,Wadi Degla SC vs Al Moqawloon Al Arab,2.90,2.65,2.60
